{
  "id": "11111111-1111-4111-8111-111111111101",
  "organization_id": "11111111-1111-4111-8111-111111111111",
  "source": "slack",
  "external_event_id": "slack-message-auth-001",
  "external_url": "https://slack.example.test/archives/engineering/p1704882600000000",
  "event_type": "message",
  "occurred_at": "2025-01-10T10:30:00Z",
  "received_at": "2025-01-10T10:31:00Z",
  "actor": {
    "id": "slack-user-maya",
    "name": "Maya Chen",
    "email": "maya.chen@example.test"
  },
  "title": "Authentication provider decision",
  "content": "Maya Chen: The Cloudberry team decided to use Supabase Auth for authentication. This decision belongs to the Cloudberry authentication project.",
  "metadata": {
    "channel": "engineering",
    "thread_ts": "1704882600.000000",
    "decision_key": "authentication-provider"
  },
  "raw_payload": {
    "provider": "slack",
    "team": "cloudberry",
    "message": {
      "ts": "1704882600.000000",
      "text": "The Cloudberry team decided to use Supabase Auth for authentication."
    }
  }
}
