{
  "id": "11111111-1111-4111-8111-111111111103",
  "organization_id": "11111111-1111-4111-8111-111111111111",
  "source": "github",
  "external_event_id": "github-pr-auth-42",
  "external_url": "https://github.example.test/cloudberry/app/pull/42",
  "event_type": "pull_request",
  "occurred_at": "2025-01-12T14:15:00Z",
  "received_at": "2025-01-12T14:16:00Z",
  "actor": {
    "id": "github-user-lee",
    "name": "Lee Park",
    "email": "lee.park@example.test"
  },
  "title": "Add Supabase Auth integration",
  "content": "Pull request #42 in the cloudberry/app repository implements Linear task AUTH-123 by adding Supabase Auth to the Cloudberry web application.",
  "metadata": {
    "repository": "cloudberry/app",
    "number": 42,
    "base_branch": "main",
    "linked_issue": "AUTH-123"
  },
  "raw_payload": {
    "provider": "github",
    "pull_request": {
      "number": 42,
      "title": "Add Supabase Auth integration",
      "repository": "cloudberry/app"
    }
  }
}
